{
  "version": 1,
  "updated_at": "2026-07-20T09:30:00Z",
  "trips": [
    "2026-07-golan-example"
  ],
  "voters": [
    "Dana",
    "Noam"
  ],
  "profiles": {
    "*": {
      "votes": 10,
      "likes": 6,
      "unlikes": 4,
      "features": {
        "both_jacuzzi": {
          "weight": 0.81,
          "confidence": 0.42,
          "liked_with": 2,
          "liked_total": 6,
          "unliked_with": 0,
          "unliked_total": 4,
          "evidence": [
            {
              "trip": "2026-07-golan-example",
              "slug": "example-past-stone-loft",
              "name": "Stone Loft (example)",
              "voter": "Dana",
              "vote": "like"
            },
            {
              "trip": "2026-07-golan-example",
              "slug": "example-past-stone-loft",
              "name": "Stone Loft (example)",
              "voter": "Noam",
              "vote": "like"
            }
          ]
        },
        "detached": {
          "weight": 1.5,
          "confidence": 0.83,
          "liked_with": 5,
          "liked_total": 6,
          "unliked_with": 0,
          "unliked_total": 4,
          "evidence": [
            {
              "trip": "2026-07-golan-example",
              "slug": "example-past-cliff-cabin",
              "name": "Cliff Cabin (example)",
              "voter": "Dana",
              "vote": "like"
            },
            {
              "trip": "2026-07-golan-example",
              "slug": "example-past-pine-hut",
              "name": "Pine Hut (example)",
              "voter": "Dana",
              "vote": "like"
            },
            {
              "trip": "2026-07-golan-example",
              "slug": "example-past-pine-hut",
              "name": "Pine Hut (example)",
              "voter": "Noam",
              "vote": "like"
            },
            {
              "trip": "2026-07-golan-example",
              "slug": "example-past-stone-loft",
              "name": "Stone Loft (example)",
              "voter": "Dana",
              "vote": "like"
            },
            {
              "trip": "2026-07-golan-example",
              "slug": "example-past-stone-loft",
              "name": "Stone Loft (example)",
              "voter": "Noam",
              "vote": "like"
            }
          ]
        },
        "jacuzzi_indoor": {
          "weight": -0.51,
          "confidence": 0.83,
          "liked_with": 3,
          "liked_total": 6,
          "unliked_with": 4,
          "unliked_total": 4,
          "evidence": [
            {
              "trip": "2026-07-golan-example",
              "slug": "example-past-garden-room",
              "name": "Garden Room (example)",
              "voter": "Dana",
              "vote": "unlike"
            },
            {
              "trip": "2026-07-golan-example",
              "slug": "example-past-garden-room",
              "name": "Garden Room (example)",
              "voter": "Noam",
              "vote": "like"
            },
            {
              "trip": "2026-07-golan-example",
              "slug": "example-past-meadow-studio",
              "name": "Meadow Studio (example)",
              "voter": "Noam",
              "vote": "unlike"
            },
            {
              "trip": "2026-07-golan-example",
              "slug": "example-past-river-suite",
              "name": "River Suite (example)",
              "voter": "Dana",
              "vote": "unlike"
            },
            {
              "trip": "2026-07-golan-example",
              "slug": "example-past-river-suite",
              "name": "River Suite (example)",
              "voter": "Noam",
              "vote": "unlike"
            },
            {
              "trip": "2026-07-golan-example",
              "slug": "example-past-stone-loft",
              "name": "Stone Loft (example)",
              "voter": "Dana",
              "vote": "like"
            },
            {
              "trip": "2026-07-golan-example",
              "slug": "example-past-stone-loft",
              "name": "Stone Loft (example)",
              "voter": "Noam",
              "vote": "like"
            }
          ]
        },
        "jacuzzi_outdoor": {
          "weight": 1.5,
          "confidence": 0.83,
          "liked_with": 5,
          "liked_total": 6,
          "unliked_with": 0,
          "unliked_total": 4,
          "evidence": [
            {
              "trip": "2026-07-golan-example",
              "slug": "example-past-cliff-cabin",
              "name": "Cliff Cabin (example)",
              "voter": "Dana",
              "vote": "like"
            },
            {
              "trip": "2026-07-golan-example",
              "slug": "example-past-pine-hut",
              "name": "Pine Hut (example)",
              "voter": "Dana",
              "vote": "like"
            },
            {
              "trip": "2026-07-golan-example",
              "slug": "example-past-pine-hut",
              "name": "Pine Hut (example)",
              "voter": "Noam",
              "vote": "like"
            },
            {
              "trip": "2026-07-golan-example",
              "slug": "example-past-stone-loft",
              "name": "Stone Loft (example)",
              "voter": "Dana",
              "vote": "like"
            },
            {
              "trip": "2026-07-golan-example",
              "slug": "example-past-stone-loft",
              "name": "Stone Loft (example)",
              "voter": "Noam",
              "vote": "like"
            }
          ]
        },
        "kitchen": {
          "weight": 0.05,
          "confidence": 0.83,
          "liked_with": 6,
          "liked_total": 6,
          "unliked_with": 4,
          "unliked_total": 4,
          "evidence": [
            {
              "trip": "2026-07-golan-example",
              "slug": "example-past-cliff-cabin",
              "name": "Cliff Cabin (example)",
              "voter": "Dana",
              "vote": "like"
            },
            {
              "trip": "2026-07-golan-example",
              "slug": "example-past-garden-room",
              "name": "Garden Room (example)",
              "voter": "Dana",
              "vote": "unlike"
            },
            {
              "trip": "2026-07-golan-example",
              "slug": "example-past-garden-room",
              "name": "Garden Room (example)",
              "voter": "Noam",
              "vote": "like"
            },
            {
              "trip": "2026-07-golan-example",
              "slug": "example-past-meadow-studio",
              "name": "Meadow Studio (example)",
              "voter": "Noam",
              "vote": "unlike"
            },
            {
              "trip": "2026-07-golan-example",
              "slug": "example-past-pine-hut",
              "name": "Pine Hut (example)",
              "voter": "Dana",
              "vote": "like"
            },
            {
              "trip": "2026-07-golan-example",
              "slug": "example-past-pine-hut",
              "name": "Pine Hut (example)",
              "voter": "Noam",
              "vote": "like"
            },
            {
              "trip": "2026-07-golan-example",
              "slug": "example-past-river-suite",
              "name": "River Suite (example)",
              "voter": "Dana",
              "vote": "unlike"
            },
            {
              "trip": "2026-07-golan-example",
              "slug": "example-past-river-suite",
              "name": "River Suite (example)",
              "voter": "Noam",
              "vote": "unlike"
            },
            {
              "trip": "2026-07-golan-example",
              "slug": "example-past-stone-loft",
              "name": "Stone Loft (example)",
              "voter": "Dana",
              "vote": "like"
            },
            {
              "trip": "2026-07-golan-example",
              "slug": "example-past-stone-loft",
              "name": "Stone Loft (example)",
              "voter": "Noam",
              "vote": "like"
            }
          ]
        },
        "long_drive": {
          "weight": -0.29,
          "confidence": 0.83,
          "liked_with": 2,
          "liked_total": 6,
          "unliked_with": 2,
          "unliked_total": 4,
          "evidence": [
            {
              "trip": "2026-07-golan-example",
              "slug": "example-past-cliff-cabin",
              "name": "Cliff Cabin (example)",
              "voter": "Dana",
              "vote": "like"
            },
            {
              "trip": "2026-07-golan-example",
              "slug": "example-past-garden-room",
              "name": "Garden Room (example)",
              "voter": "Dana",
              "vote": "unlike"
            },
            {
              "trip": "2026-07-golan-example",
              "slug": "example-past-garden-room",
              "name": "Garden Room (example)",
              "voter": "Noam",
              "vote": "like"
            },
            {
              "trip": "2026-07-golan-example",
              "slug": "example-past-meadow-studio",
              "name": "Meadow Studio (example)",
              "voter": "Noam",
              "vote": "unlike"
            }
          ]
        },
        "near_host": {
          "weight": -0.98,
          "confidence": 0.83,
          "liked_with": 1,
          "liked_total": 6,
          "unliked_with": 3,
          "unliked_total": 4,
          "evidence": [
            {
              "trip": "2026-07-golan-example",
              "slug": "example-past-garden-room",
              "name": "Garden Room (example)",
              "voter": "Dana",
              "vote": "unlike"
            },
            {
              "trip": "2026-07-golan-example",
              "slug": "example-past-garden-room",
              "name": "Garden Room (example)",